{
  "$schema": "./decision-coverage.schema.json",
  "manifestVersion": "0.2.0",
  "snapshot": "2026-07-20",
  "resolutionPath": "docs/refinement/owner-decision-responses.md",
  "packets": {
    "01": {
      "path": "docs/reports/component-refinement-decision-packet.md",
      "status": "owner-decisions-recorded",
      "componentDecisions": {
        "pin-input": "H7-A",
        "hero": "G1-A",
        "popup": "G4-A",
        "countdown": "G7-A",
        "cookie-consent": "G9-A",
        "announcement-extended": "G11-A",
        "reading-progress": "L4-A",
        "filter-bar": "L7-B",
        "share-buttons": "L9-A",
        "logo-bar": "S12-A",
        "before-after": "S17-A",
        "marquee": "S18-A"
      }
    },
    "02": {
      "path": "docs/reports/component-refinement-decision-packet-02-commerce-core.md",
      "status": "owner-decisions-recorded",
      "componentDecisions": {
        "progress": "A22-A",
        "rating": "A11-A",
        "star-rating": "A11-A",
        "empty-state": "A13-A",
        "avatar": "A15-A",
        "product-card": "D1-A",
        "product-gallery": "D2-C",
        "product-info": "D3-A",
        "variant-selector": "D4-A",
        "product-form": "D5-A",
        "size-chart": "D7-A",
        "back-in-stock": "D8-A",
        "pickup-location-selector": "D9-C",
        "store-locator": "D9-C",
        "subscription-option": "D10-A",
        "filter-panel": "E3-A",
        "view-toggle": "E5-B",
        "collection-promo": "E6-A",
        "empty-collection": "E7-A"
      }
    },
    "03": {
      "path": "docs/reports/component-refinement-decision-packet-03-marketing-cart-account.md",
      "status": "owner-decisions-recorded",
      "sharedDecisionCodes": ["U0-A"],
      "componentDecisions": {
        "newsletter": "G2-A",
        "urgency": "G8-B",
        "social-proof": "G10-A",
        "cart-page": "K1-A",
        "quick-view": "K8-A",
        "sticky-atc": "K9-A",
        "gift-wrap": "K11-A",
        "auth-forms": "U1-A",
        "password-reset": "U2-A",
        "account-dashboard": "U3-A",
        "order-history": "U4-A",
        "order-detail": "U5-A",
        "address-book": "U6-A",
        "address-form": "U7-A",
        "wishlist": "U8-A",
        "account-settings": "U9-A"
      }
    },
    "04": {
      "path": "docs/reports/component-refinement-decision-packet-04-content-sections.md",
      "status": "owner-decisions-recorded",
      "componentDecisions": {
        "article-card": "L1-A",
        "article-hero": "L2-A",
        "article-body": "L3-A",
        "table-of-contents": "L5-A",
        "author-card": "L6-A",
        "blog-sidebar": "L8-A",
        "related-articles": "L10-A",
        "comments": "L11-A",
        "material-library": "R1-A",
        "glaze-guide": "R2-A",
        "technique-explainer": "R3-A",
        "care-instructions": "R4-A",
        "dimensions": "R5-A",
        "firing-info": "R6-A",
        "workshop-listing": "R7-A",
        "commission-form": "R8-A",
        "makers-mark": "R9-A",
        "edition-badge": "R10-A",
        "hero-section": "G1-A",
        "comparison-table": "S13-A"
      }
    }
  }
}
